{
  "email": "jarda.vojtasek@procelyx.cz",
  "phone": "+420 724 796 243",
  "founderName": "Jaroslav Vojtášek",
  "founderTitle": {
    "cs": "Zakladatel PROCELYX · Automatizace a digitální procesy",
    "en": "Founder of PROCELYX · Automation & digital processes"
  },
  "seoTitle": {
    "cs": "PROCELYX — AI automatizace a digitální procesy pro firmy",
    "en": "PROCELYX — AI Automation & Digital Processes for Business"
  },
  "seoDescription": {
    "cs": "Méně přepisování, rychlejší předávání práce a přehled o zakázkách. PROCELYX propojuje vaše systémy a zavádí AI automatizaci od jednoho měřitelného pilotu.",
    "en": "Less data entry, smoother handovers and a clear view of your work. PROCELYX connects your systems and introduces AI automation through one measurable pilot."
  },
  "ogImage": "/images/procelyx-process.jpg",
  "chatDemoEnabled": true,
  "businessId": "48783447",
  "businessSeat": "U Jízdárny 577, 747 64 Velká Polom, Česká republika"
}
